{
  "schema_version": "1.0",
  "work_item_id": "ASDLC-1",
  "title": "Evidence stack: stacked PRs with typed red/green/review commits, locked contract and feature knowledge",
  "date": "2026-10-28",
  "problem_statement": "ACCORD's agentic workflow suits small changes. For a new feature or greenfield solution, engineers cannot gain confidence in the code's lineage or in the process that produced it. One branch and one PR carry many concerns, and the red and green test runs, adversarial review rounds and fix rounds live in gitignored .tasks/, so git holds no evidence of them. Reviewers read one large diff plus verify.md. There is no capability-keyed record of what the system does, so new work cannot be checked against older features.",
  "proposed_solution": "Make git history the evidence log and keep a durable evidence asset per PR. Deliver nine features, in dependency order, each a stack of task PRs behind switches that default to off (stack.enabled, knowledge.enabled, stack.commits): commit-evidence (commit grammar, Accord trailer, orchestrator-only per-phase commits, accord evidence timeline); evidence-asset (final evidence commit and asset); security-gate (review-security gates in the C loop); contract-lock (PR0, contract.lock.json, contract-amend); stack-compute (plan fields, computeStack, gh StackProvider, stack map and PR brief); tree-state (committed state for stateless resume, closeout); trunk-hardening (open-PR depth cap, flags, bottom-up merge, accord/evidence check, overrun decision); feature-knowledge (capability-keyed docs, impact analysis, drift check); ci-driven-mode (CI builds PR0 and task PRs from brief and spec). One PR covers one concern, stays small and safe to merge to main, and oversized tasks are re-planned, never split by the harness. Terms: a work item is the ticket-keyed change (ASDLC-1); a feature is a slug-keyed unit of system behaviour with a living doc in docs/features, delivered by N tasks and composed through depends_on; a task is one plan unit and one PR; phase means only a harness agent step (phase-test, phase-code). Design: docs/plans/evidence-stack-plan.md; brief: docs/dev/ASDLC-1/brief.md.",
  "acceptance_criteria": [
    {
      "id": "AC-1",
      "requirement": "MUST",
      "type": "scenario",
      "scenario": "Given stack.commits is \"phase\" (default \"task\"; independent of stack.enabled) and a task runs a test round\nWhen phase-test, review-test, phase-code, review-security, review-code and phase-verify-task each return\nThen the orchestrator makes one commit per phase completion, each subject names its ref (T1/phase-test, C1/review-security, V1/phase-verify-task), agents never commit, and each review commit holds its findings before the next phase starts"
    },
    {
      "id": "AC-2",
      "requirement": "MUST",
      "type": "scenario",
      "scenario": "Given a commit built by commit-grammar\nWhen the Accord trailer is parsed and validated\nThen it is one line of key=value pairs, required keys are present, counts equal the staged findings and tests, unknown x_ keys are ignored, and the documented awk extraction over git log returns the same values"
    },
    {
      "id": "AC-3",
      "requirement": "MUST",
      "type": "scenario",
      "scenario": "Given a review commit stages a file outside docs/dev/<ID>/reviews/** and docs/dev/<ID>/state/**, or a code-loop commit stages a test file\nWhen the orchestrator runs the commit guard\nThen the out-of-scope path is not committed, a stack.guard.rejected log event is emitted, and a test edit respawns phase-test"
    },
    {
      "id": "AC-4",
      "requirement": "MUST",
      "type": "scenario",
      "scenario": "Given a branch with typed phase commits\nWhen the user runs accord evidence <ID>, with --format tsv or without\nThen a timeline is rendered from git trailers only (ref, outcome, counts, tokens, cost) and the tsv columns match the documented awk extraction"
    },
    {
      "id": "AC-5",
      "requirement": "MUST",
      "type": "scenario",
      "scenario": "Given a task PR whose phases are done\nWhen the final commit is made\nThen it is evidence(task-<N>) (evidence(task-<N>,<M>) for a merged PR), writes docs/dev/<ID>/evidence/task-<N>.{md,json} per task from commits and trailers (red and green excerpts, findings, review-to-fix patches, planned vs actual size), and deletes docs/dev/<ID>/state/task-<N>/\nAnd the asset still exists after a squash merge"
    },
    {
      "id": "AC-6",
      "requirement": "MUST",
      "type": "scenario",
      "scenario": "Given orchestration.review_loop.review_security.severity_gate is unset and stack.enabled is false\nWhen review-security returns critical, warning or suggestion findings\nThen they stay advisory exactly as today and no round is gated"
    },
    {
      "id": "AC-7",
      "requirement": "MUST",
      "type": "scenario",
      "scenario": "Given stack.enabled is true and severity_gate is unset (effective warn), or severity_gate is set to block, warn or none\nWhen review-security returns open findings in a C round\nThen findings at or above the gate severity gate the round (block: critical; warn: critical and warning; none: any), suggestions stay advisory under warn and block, the next C round phase-code fixes security and code findings together, review-code re-reviews it, and at the code_review retry cap the task blocks for a human"
    },
    {
      "id": "AC-8",
      "requirement": "MUST",
      "type": "scenario",
      "scenario": "Given implement or greenfield work with stack.enabled\nWhen the contract is approved\nThen PR0 contains docs/dev/<ID>/{brief.md,spec.json,plan.json}, state/work-item.json and contract.lock.json with sha256 of each plus the sha of the commit preceding the lock commit, and the lock commit is tagged accord/<ID>/contract (the tag is informational; the lock file is the durable record and survives squash)\nAnd an edit to a locked file without a contract-amend fails the hook and the CI check, while a contract-amend PR with diff, reason and affected ACs passes and marks downstream tasks stale"
    },
    {
      "id": "AC-9",
      "requirement": "MUST",
      "type": "scenario",
      "scenario": "Given a plan with est_lines, concern, depends_on, flag and kind on each task\nWhen computeStack runs twice with the same config\nThen the output is byte-identical, adjacent same-concern tasks below min_pr_lines merge within the budget, a task above max_pr_lines or max_files is flagged for re-plan and never split, independent tasks are siblings, and PR count is 2 plus packed task groups"
    },
    {
      "id": "AC-10",
      "requirement": "MUST",
      "type": "scenario",
      "scenario": "Given stack.provider is \"gh\" behind the StackProvider port\nWhen accord stack submit runs for a computed stack\nThen PRs are created or updated with a stack map comment and a generated PR brief (contract link first, ACs and proving tests, process summary, reading order), one accord/evidence status check replaces bot comments, accord stack <ID> prints the computed stack table, accord stack sync refreshes it from provider state, accord stack report renders the per-PR roll-up from trailers (rows per loop; rounds, findings, tests, tokens, cost), dev_stack_* MCP tools return the same results, and an unsupported provider fails with a clear error"
    },
    {
      "id": "AC-11",
      "requirement": "MUST",
      "type": "scenario",
      "scenario": "Given stack.state.persist is \"tree\" and stack.state.redact is true\nWhen the orchestrator makes any typed commit except the final evidence(task-<N>) commit, which deletes the directory\nThen docs/dev/<ID>/state/task-<N>/ in the same commit holds STATE.md (the accord trace rendering) and a redacted task.json valid against task-schema.json with in_flight null, test output is redacted (secrets and tokens, environment values, home-directory absolute paths, prompts and transcripts) and capped at stack.state.max_bytes, raw return packets are never staged, and with stack.state.redact false no state is committed (tree persistence requires redaction)"
    },
    {
      "id": "AC-12",
      "requirement": "MUST",
      "type": "scenario",
      "scenario": "Given a fresh clone checked out at any typed commit of a task branch before its evidence commit (after it the task is done and has nothing to resume)\nWhen accord resumes with no local .tasks/\nThen state is rebuilt from docs/dev/<ID>/state/ and the other artifacts, the next ref is the same as in the original run, findings are read from the tree with no review re-run, and the evidence asset regenerated from the last pre-deletion commit equals the committed asset"
    },
    {
      "id": "AC-13",
      "requirement": "MUST",
      "type": "scenario",
      "scenario": "Given the closeout commit has deleted the rest of docs/dev/<ID>/state/\nWhen the accord/evidence check runs on a PR to main\nThen it passes while the work item is open (state/work-item.json from PR0 and in-flight task state are allowed on PR heads before their evidence commit), and it fails if docs/dev/<ID>/state/task-* remains at a PR head after its evidence commit, or if any docs/dev/*/state/ exists on main after closeout"
    },
    {
      "id": "AC-14",
      "requirement": "MUST",
      "type": "scenario",
      "scenario": "Given all task PRs are done\nWhen the closeout commit is made\nThen verify.*, trace.* and workflow-cost.* are built, the remaining docs/dev/<ID>/state/ (including work-item.json) is deleted after they are built, and the closeout PR is the last PR of the stack"
    },
    {
      "id": "AC-15",
      "requirement": "MUST",
      "type": "scenario",